text,language
She couldn't decide if the glass was half empty or half full so she drank it, English
The tour bus was packed with teenage girls heading toward their next adventure, English
Willekeurige woorden voor andere willekeurige woorden creëren een willekeurige zin,Nederlands
Alles wat sy wou hê was die antwoord maar sy het geen idee hoe baie sy dit sou haat nie,Afrikaans
Ons het baie reën in Junie,Afrikaans
Pat ordered a ghost pepper pie, English
She found his complete dullness interesting, English
The Japanese yen for commerce is still well-known, English
Ik ben nooit thuis op zondagen,Nederlands
Knoflookijs was haar favoriet,Nederlands
Die horlosie binne hierdie blog en die horlosie op my laptop is 1 uur van mekaar verskillend,Afrikaans
As the asteroid hurtled toward earth Becky was upset her dentist appointment had been canceled, English
He learned the hardest lesson of his life and had the scars both physical and mental to prove it, English
Dit blyk dat jy nie al daardie dinge nodig het wat jy aangedring het jy het nie,Afrikaans
The minute she landed she understood the reason this was a fly-over state, English
Het wake achter de boot vertelde over het verleden terwijl de open zee het leven in de onbekende toekomst voorspelde,Nederlands
Wisdom is easily acquired when hiding under the bed with a saucepan on your head, English
Op dat moment realiseerde ze zich dat ze een zesde zintuig had,Nederlands
Hy het een blik na wat onder die tafel was gewerp en het daar weggehardloop,Afrikaans
Ze heeft niet gespiekt op de test want dat was niet het juiste om te doen,Nederlands
De schutter neemt afscheid van zijn liefde,Nederlands
Hy het gewag vir die stop teken om in 'n gaan teken te verander,Afrikaans
Hy het gewonder of dit 'n strand genoem kon word as daar geen sand was nie,Afrikaans
Die lig in sy lewe was eintlik 'n vuur wat rondom hom gebrand het,Afrikaans
Lightning Paradise was de lokale ontmoetingsplek waar de groep meestal de nacht doorbracht,Nederlands
Andy het daarvan gehou om op 'n bed van naels te slaap,Afrikaans
Die ewekansige sin generateur het 'n ewekansige sin oor 'n ewekansige sin gegenereer,Afrikaans
He decided to live his life by the big beats manifesto, English
Your girlfriend bought your favorite cookie crisp cereal but forgot to get milk, English
Patricia hou van die klank van naels wat sterk teen die borddruk,Afrikaans
As eet van drie-eier omelette gewigstoename veroorsaak is budgie eiers 'n goeie plaasvervanger,Afrikaans
Although it wasn't a pot of gold Nancy was still enthralled at what she found at the end of the rainbow, English
Er waren witte omstandigheden in de stad vervolgens waren de wegen onbegaanbaar,Nederlands
Bill ran from the giraffe toward the dolphin, English
Je vriendin kocht je favoriete cookie crisp ontbijtgranen maar vergat melk te halen,Nederlands
Alles wat je hoeft te doen is de pen oppakken en beginnen,Nederlands
As jy van tuna en tamatiesous hou probeer om die twee te kombineer Dit is regtig nie so sleg soos dit klink nie,Afrikaans
Ze zegt dat ze de vaardigheid heeft om de soundtrack van je leven te horen,Nederlands
He spiked his hair green to support his iguana, English
The green tea and avocado smoothie turned out exactly as would be expected, English
Sy kan haar lewe lewe hoe sy wil solank sy na wat ek te sê het luister,Afrikaans
Hy wou nie na die tandarts gaan nie maar hy het tog gegaan,Afrikaans
Sometimes you have to just give up and win by cheating, English
Jou vriendin het jou gunsteling koekie-krummels cereal gekoop maar vergeet om melk te kry,Afrikaans
I like to leave work after my eight-hour tea-break, English
He is good at eating pickles and telling women about his emotional problems, English
He is no James Bond; his name is Roger Moore, English
Jy byt op omdat van jou onderkaak,Afrikaans
Sy het haar sakdoekjies netjies gevou,Afrikaans
Het was een glibberige helling en hij was bereid om helemaal naar de diepste diepten te glijden,Nederlands
I'm a great listener really good with empathy vs sympathy and all that but I hate people, English
The door swung open to reveal pink giraffes and red elephants, English
She looked at the masterpiece hanging in the museum but all she could think is that her five-year-old could do better, English
Daar is 'n kuns om jou sin te kry en om olyfpitte oor die tafel te spat is dit,Afrikaans
Iedereen was nieuwsgierig naar het grote witte luchtzeil dat opeens verscheen,Nederlands
Hy het per ongeluk in sy maatskappy se bediener gehack,Afrikaans
They wandered into a strange Tiki bar on the edge of the small beach town, English
We hebben jonge kinderen die vaak 's nachts onze kamer binnenkomen om verschillende redenen waaronder clowns in de kast,Nederlands
Peanut butter and jelly caused the elderly lady to think about her past, English
They ran around the corner to find that they had traveled back in time, English
Hij is goed in het eten van augurken en het vertellen van vrouwen over zijn emotionele problemen,Nederlands
Vleeskleurige yogabroeken waren veel erger dan hij ooit vreesde,Nederlands
Hit me with your pet shark, English
Kontroleer weer morgen ek sal kyk of die boek aangekom het,Afrikaans
Ze gooien kool die je hersenen in emotionele bagage verandert,Nederlands
Jy besef jy is nie alleen nie terwyl jy in jou slaapkamer sit en jou kalwers masseer na 'n lang dag van touwtrekker met Oupa Joe in die hospitaal,Afrikaans
Hij raakte door zijn geld heen dus moest hij stoppen met pokeren,Nederlands
Dit was op daardie oomblik dat hy geleer het daar is sekere dele van die liggaam wat jy nooit moet Nair nie,Afrikaans
As she walked along the street and looked in the gutter she realized facemasks had become the new cigarette butts, English
Selfs met die sneeu wat buite val het sy dit gepas geag om haar bikini te dra,Afrikaans
Almal was besig so het ek alleen na die fliek gegaan,Afrikaans
Ze dwaalden een vreemde Tiki-bar binnen aan de rand van het kleine strandstadje,Nederlands
Ze vond zijn volledige saaiheid interessant,Nederlands
Die byna-dood ervaring het nuwe idees aan die lig gebring,Afrikaans
The bees decided to have a mutiny against their queen, English
Everybody should read Chaucer to improve their everyday vocabulary, English
Ik at een sok omdat mensen op het internet me dat zeiden,Nederlands
Afgelopen vrijdag zag ik een gestreepte blauwe worm met vlekken de hand schudden met een pootloze hagedis,Nederlands
Terwyl die huurmotor tot stilstand kom op die donker pad het haar vrees met die oomblik toegeneem,Afrikaans
Op dat moment leerde hij dat er bepaalde delen van het lichaam zijn die je nooit moet ontharen met Nair,Nederlands
The beach was crowded with snow leopards, English
Er is een reden waarom rozen doornen hebben,Nederlands
It was difficult for Mary to admit that most of her workout consisted of exercising poor judgment, English
Laat ek jou help met jou bagasie,Afrikaans
Iguana's vielen uit de bomen,Nederlands
Winkelsentrums is wonderlike plekke om te koop ek kan alles wat ek nodig het onder een dak vind,Afrikaans
We have young kids who often walk into our room at night for various reasons including clowns in the closet, English
Die vinnige bruin volstruis spring oor die lui hond,Afrikaans
De bijna-doodervaring bracht nieuwe ideeën aan het licht,Nederlands
She had a difficult time owning up to her own crazy self, English
I caught my squirrel rustling through my gym bag, English
Die skelet het sy eie skelette in die kas gehad,Afrikaans
Ik denk dat ik de rode auto zal kopen of de blauwe zal leasen,Nederlands
Three generations with six decades of life experience, English
Op daardie oomblik het hy nie na musiek geluister nie hy het 'n ervaring geleef,Afrikaans
He strives to keep the best lawn in the neighborhood, English
He figured a few sticks of dynamite were easier than a fishing pole to catch fish, English
Die varke was geërger dat hulle hamburgers genoem is,Afrikaans
He wondered why at 18 he was old enough to go to war but not old enough to buy cigarettes, English
He played the game as if his life depended on it and the truth was that it did, English
Er zijn weinig dingen beter in het leven dan een stuk taart,Nederlands
25 years later she still regretted that specific moment, English
Die vader het tydens die bevalling gesterf,Afrikaans
Dit is 'n Japannese pop,Afrikaans
Rood is zeker groener dan paars,Nederlands
It's much more difficult to play tennis with a bowling ball than it is to bowl with a tennis ball, English
Soms staar ek na 'n deur of 'n muur en ek wonder wat is hierdie realiteit waarom is ek lewendig en waaroor gaan alles,Afrikaans
Sy het 'n gewoonte gehad om in limonade te stort,Afrikaans
Joyce het daarvan gehou om pannekoeke met ketchup te eet,Afrikaans
Ze kon hem in de douche horen zingen met een vreugde waarvan ze hoopte dat hij die zou behouden nadat ze het nieuws had gebracht,Nederlands
Alles wat ze konden zien was het blauwe water rondom hun zeilboot,Nederlands
He took one look at what was under the table and noped the hell out of there, English
It was obvious she was hot sweaty and tired, English
Om 'n lys van ewekansige sinne te skryf is moeiliker as wat ek aanvanklik gedink het,Afrikaans
Tom kreeg een klein stuk taart,Nederlands
She wore green lipstick like a fashion icon, English
It would have been a better night if the guys next to us weren't in the splash zone, English
Die roestige spyker het regop gestaan en was op 'n 45-grade hoek gekantel net wag vir die perfekte blote voet om verby te kom,Afrikaans
Die skoonheid van die Afrika sonondergang het die gevaar wat naby loer vermom,Afrikaans
Hy was bereid om die dieptes van die haas se gat te vind om by haar te wees,Afrikaans
If eating three-egg omelets causes weight-gain budgie eggs are a good substitute, English
She always had an interesting perspective on why the world must be flat, English
Italië is mijn favoriete land in feite ben ik van plan om er volgend jaar twee weken door te brengen,Nederlands
Hy is in 'n seunband wat nie veel sin maak vir 'n slang nie,Afrikaans
Hij wilde niet naar de tandarts maar ging toch,Nederlands
Ek verkies om 'n voël te wees eerder as 'n vis,Afrikaans
Ons moet met Legos by die kamp speel,Afrikaans
Ik heb momenteel 4 vensters open en ik weet niet waarom,Nederlands
He excelled at firing people nicely, English
Ze had de gewoonte om te douchen in limonade,Nederlands
Ek hoor dat Nancy baie mooi is,Afrikaans
Hij vond het einde van de regenboog en was verrast over wat hij daar vond,Nederlands
She was sad to hear that fireflies are facing extinction due to artificial light habitat loss and pesticides, English
De deur knalde op de watermeloen,Nederlands
Die toer bus was vol met tienermeisies wat op pad was na hulle volgende avontuur,Afrikaans
Hij investeerde wat vaardigheidspunten in Charisma en Kracht,Nederlands
Sy het die boek baie jare gelede van hom geleen en het dit nog nie teruggebring nie,Afrikaans
The doll spun around in circles in hopes of coming alive, English
He didn't heed the warning and it had turned out surprisingly well, English
The beauty of the African sunset disguised the danger lurking nearby, English
Terwijl hij wachtte tot de douche opwarmde merkte hij dat hij de temperatuurverandering van het water kon horen,Nederlands
The gruff old man sat in the back of the bait shop grumbling to himself as he scooped out a handful of worms, English
Hij leerde de belangrijke les dat een picknick op het strand op een winderige dag een slecht idee is,Nederlands
Hy het besef daar was verskeie sterftes op hierdie pad maar sy bekommernis het toegeneem toe hy die presiese aantal gesien het,Afrikaans
Die dik loof en verstrengelde ranke het die stap naby aan onmoontlik gemaak,Afrikaans
Hij negeerde de waarschuwing en het bleek verrassend goed te gaan,Nederlands
He decided water-skiing on a frozen lake wasn’t a good idea, English
She was the type of girl who wanted to live in a pink house, English
Die son het gesak en sy drome ook,Afrikaans
De oude appel koestert zijn autoriteit,Nederlands
Ik wil een onesie kopen maar weet dat het me niet zal staan,Nederlands
Hij had een verborgen voorraad onder de vloerdelen in de achterkamer van het huis,Nederlands
He shaved the peach to prove a point, English
He embraced his new life as an eggplant, English
Het mysterieuze dagboek registreert de stem,Nederlands
"David volg die ""prop jou tent in die sak"" strategie eerder as om dit netjies te vou",Afrikaans
8% van 25 is hetzelfde als 25% van 8 en een van hen is veel gemakkelijker in je hoofd te doen,Nederlands
Het spoedzorgcentrum was overspoeld met patiënten na het nieuws over een nieuwe dodelijke virus werd bekendgemaakt,Nederlands
Moet nie grondboontjiebotter op die hond se neus sit nie,Afrikaans
Om niks te kies nie is steeds 'n keuse,Afrikaans
Everyone says they love nature until they realize how dangerous she can be, English
Vaarwel en bedankt voor de vis,Nederlands
Fluffy pink unicorns are a popular status symbol among macho men, English
Die rivier het die gode gesteel,Afrikaans
He poured rocks in the dungeon of his mind, English
Die vis het aandagtig geluister na wat die paddas te sê gehad het,Afrikaans
Bill het van die giraffe af na die dolfyn hardloop,Afrikaans
Excitement replaced fear until the final moment, English
Iedereen zou Chaucer moeten lezen om hun dagelijkse vocabulaire te verbeteren,Nederlands
Dit is een Japanse pop,Nederlands
Niemand houdt van een varken met lippenstift,Nederlands
"David subscribes to the ""stuff your tent into the bag"" strategy over nicely folding it", English
Het blijkt dat je al die spullen die je dacht nodig te hebben niet nodig hebt,Nederlands
Agter die venster was 'n weerkaatsing wat net vrees ingeplant het,Afrikaans
Sy het daardie koue gevoel gehad wat die hare op jou nek laat regop staan wanneer hy die kamer binnegestap het,Afrikaans
Laat me je helpen met je bagage,Nederlands
Dan at de wolken als suikerspin,Nederlands
Hy was 100% in vir vas met haar totdat hy verstaan het dit beteken hy kan nie eet nie,Afrikaans
Hij vond een leprechaun in zijn walnootschaal,Nederlands
Die skare skree en skree vir meer memes,Afrikaans
Ek tel my kalorieë maar ek wil regtig nagereg hê,Afrikaans
Zijn zeven-laags taart had slechts zes lagen,Nederlands
The murder hornet was disappointed by the preconceived ideas people had of him, English
Hy het in die donker gefrommel op soek na die ligskakelaar maar toe hy dit uiteindelik gevind het was daar iemand al klaar daar,Afrikaans
Pindakaas en jam deden de oudere dame denken aan haar verleden,Nederlands
Die ou appel skaal op sy gesag,Afrikaans
Please tell me you don't work in a morgue, English
Dan maakte de diepe duik in het konijnenhol,Nederlands
Hij was 100% voor het vasten met haar totdat hij begreep dat dat betekende dat hij niet mocht eten,Nederlands
Wanneer ek spaghetti kook hou ek daarvan om dit 'n paar minute na al dente te kook sodat die noedels super glad is,Afrikaans
Die guinea fowl vlieg deur die lug met al die grasie van 'n skilpad,Afrikaans
Sy het haar bes gedoen om hom te help,Afrikaans
Soms is dit beter om net weg te stap van dinge en later weer terug te kom wanneer jy in 'n beter bui is,Afrikaans
Sy selfvertroue sou bewonderenswaardig gewees het as dit nie vir sy domheid was nie,Afrikaans
As he waited for the shower to warm he noticed that he could hear water change temperature, English
Je realiseert je dat je niet alleen bent terwijl je in je slaapkamer zit en je kuiten masseert na een lange dag touwtrekken met opa Joe in het ziekenhuis,Nederlands
Hy het die einde van die reënboog gevind en was verbaas oor wat hy daar gevind het,Afrikaans
Ik zou liever een vogel dan een vis zijn,Nederlands
Abstraksie is dikwels een vloer bo jou,Afrikaans
Even though he thought the world was flat he didn’t see the irony of wanting to travel around the world, English
Die wake agter die boot het die verlede vertel terwyl die oop see die lewe in die onbekende toekoms voorspel het,Afrikaans
Ik was heel trots op mijn bijnaam tijdens de middelbare school maar vandaag zou ik niet verder van mijn bijnaam kunnen afwijken,Nederlands
The fish dreamed of escaping the fishbowl and into the toilet where he saw his friend go, English
Dit was altyd gevaarlik om met hom te ry aangesien hy daarop aangedring het dat die veiligheid-konne 'n slalombaan was,Afrikaans
They were excited to see their first sloth, English
The thunderous roar of the jet overhead confirmed her worst fears, English
Ze was het type meisje dat in een roze huis wilde wonen,Nederlands
The random sentence generator generated a random sentence about a random sentence, English
It turns out you don't need all that stuff you insisted you did, English
Als ik iets niet leuk vind blijf ik er weg van,Nederlands
You realize you're not alone as you sit in your bedroom massaging your calves after a long day of playing tug-of-war with Grandpa Joe in the hospital, English
She was too busy always talking about what she wanted to do to actually do any of it, English
He went on a whiskey diet and immediately lost three days, English
The Guinea fowl flies through the air with all the grace of a turtle, English
Sy praat altyd in 'n harde stem met hom,Afrikaans
There were three sphered rocks congregating in a cubed room, English
She had some amazing news to share but nobody to share it with, English
Hy het die diep ruimte 'n sagte geel gekleur,Afrikaans
If my calculator had a history it would be more embarrassing than my browser history, English
De ironie van de situatie ging niemand in de kamer verloren,Nederlands
Soms is alles wat jy moet doen om jouself heeltemal belaglik te maak en dit af te lag om te besef dat die lewe regtig nie so sleg is nie,Afrikaans
Choosing to do nothing is still a choice after all, English
Dit het hom onkant gevang dat die ruimte na gebraai steak geruik het,Afrikaans
Doris het daarvan gehou om haar naels op die tafel te tik om almal te irriteer,Afrikaans
Het geheugen dat we vroeger deelden is niet meer coherent,Nederlands
Liefde is nie soos pizza nie,Afrikaans
Martha came to the conclusion that shake weights are a great gift for any occasion, English
The urgent care center was flooded with patients after the news of a new deadly virus was made public, English
Ze zag geen ironie in het vragen om mij te veranderen maar wilde dat ik haar accepteerde zoals ze is,Nederlands
Italië is my gunsteling land eintlik beplan ek om twee weke daar volgende jaar deur te bring,Afrikaans
She looked into the mirror and saw another person, English
Haar haar woei in de wind terwijl ze in de zwarte cabrio reed,Nederlands
